ID,project,class,method,merge commit,Confluence Inter,OA Inter,left right DFP-Inter,right left DFP-Inter,left right PDG,right left PDG,Original Sample,Léuson,Roberto,DeSouza,LOI,Locally Observable Interference Description,Lines in the merge commit with changes made by left,Lines in the merge commit with changes made by right,Summary of changes made by left,Summary of changes made by right,Result Analyses,OR Result,Confluence Inter Result,OA Inter Result,DF Inter Result,PDG Result
2,antlr4,org.antlr.v4.codegen.target.Python2Target,python2Keywords,69ff2669eec265e25721dbc27cb00f6c381d0b41,FALSE,FALSE,FALSE,FALSE,FALSE,FALSE,Leuson,x,,,-,Left and Right change the same array; which means they change the leght of the object. A test case should explore the array lenght in each merge scenario commit. A test case to detect this conflict can be found here.,[64],[53],Left changes the list of values of an array of Strings during its initialization (adition of a new value),Right changes the list of values of an array of Strings during its initialization (adition of a new value),FALSE,TRUE NEGATIVE,,,,
3,antlr4,org.antlr.v4.codegen.target.Python3Target,python3Keywords,69ff2669eec265e25721dbc27cb00f6c381d0b41,FALSE,FALSE,FALSE,FALSE,FALSE,FALSE,Leuson,x,,,-,Left and Right change the same array; which means they change the leght of the object. A test case should explore the array lenght in each merge scenario commit. A test case to detect this conflict can be found here.,[64],[53],Left changes the list of values of an array of Strings during its initialization (adition of a new value),Right changes the list of values of an array of Strings during its initialization (adition of a new value),FALSE,TRUE NEGATIVE,,,,
4,druid,com.metamx.druid.loading.S3SegmentPusher,push(File; DataSegment),05168808c278c080c59c19e858d9471b316cd1f5,FALSE,FALSE,FALSE,FALSE,FALSE,TRUE,Roberto,x,x,,No,There is no locally observable interference as the contributions change different objects; and these changes are not accessed by each other.,[66; 118; 139; 110],[105; 125],Left changes the object that will be returned by setting the object field binaryVersion.,Right set the field acl on object toPush; which is used by the returned object.,TRUE,FALSE POSITIVE,TRUE NEGATIVE,TRUE NEGATIVE,TRUE NEGATIVE,FALSE POSITIVE
5,netty,org.jboss.netty.handler.codec.frame.LengthFieldBasedFrameDecoder,decode(ChannelHandlerContext; Channel; ChannelBuffer),193acdb36cd3da9bfc62dd69c4208dff3f0a2b1b,FALSE,FALSE,FALSE,FALSE,FALSE,TRUE,Roberto,x,x,,Yes,The changes performed by right will only be executed in some cases because of the change performed by Left. So the method return can be different for each version of the merge scenario. In the base commit; the local variable frameLength will be updated; and consequently the buffer will be updated (buffer.skipBytes(buffer.readableBytes())); that is used to create the method return. In the Left commit; as the !lengthFieldIncludedInFrameLength == TRUE; the local variable frameLength will not be updated; and consequently the buffer will not be updated (buffer.skipBytes(buffer.readableBytes())). In the Merge commit; as the !lengthFieldIncludedInFrameLength == TRUE; the local variable frameLength will not be updated; and consequently the buffer will not be updated (buffer.skipBytes(buffer.readableBytes())); but the call for failIfNecessary will update the parameter ctx. A test case to detect the conflict can be found here.,[358; 360],[322; 374],Left updates how variable frameLength is incremented; which is done only if the new conditional in the if statement is true.,Right updates method call failIfNecessary adding a new parameter (boolean value). [But these changes were also done by Left.],TRUE,TRUE POSITIVE,FALSE NEGATIVE,FALSE NEGATIVE,FALSE NEGATIVE,TRUE POSITIVE
6,OpenTripPlanner,org.opentripplanner.routing.spt.MultiShortestPathTree,dominates(State; State),4c506dce43775704919d084f0acfba86d251bf4a,FALSE,FALSE,FALSE,FALSE,TRUE,FALSE,Roberto,x,x,,Yes,The new if statement added by right checks an action; which if true returns false. As these modifications are placed before the changes introduced by Left; these last contributions could not be executed under the new circumstances. So the method result may present different return values. The assertion would use the method return (boolean). In the Base commit; all the initial if statements are FALSE; so the method return would be return walkDistanceBetter && weightBetter && timeBetter (it should return FALSE). In the Left commit; all the initial if statements are FALSE; so the method return will be walkDistanceIsHopeful && weightIsHopeful && timeIsHopeful (it should return TRUE). In the Merge commit; all the initial if statements are FALSE; but the new if thisState.isBikeParked() != other.isBikeParked() is TRUE; and the method return FALSE. A test case to detect this conflict can be found here.,[144; 146; 147; 148; 149; 152; 141],[123],Left renames some local variables and updates three boolean local variables used to define the method return.,Right adds a new if statement; which may return false.,TRUE,TRUE POSITIVE,FALSE NEGATIVE,FALSE NEGATIVE,FALSE NEGATIVE,TRUE POSITIVE
7,webbit,org.webbitserver.netty.WebSocketClient,adjustPipelineToWebSocket(ChannelHandlerContext; MessageEvent; ChannelHandler; ChannelHandler),74d2d2b87704d003acacb34e4ca8fb5f897b938f,FALSE,FALSE,FALSE,FALSE,FALSE,FALSE,Roberto,x,x,,No,There is no locally observable interference as one of the contributions is a refactoring.,[260],[262],Left sets the version of webSockectConnection object calling the method setHybiWebSocketVersion.,Right changes the order of parameters used to create the local variable webSocketChannelHandler; so it's a refactoring.,FALSE,TRUE NEGATIVE,TRUE NEGATIVE,TRUE NEGATIVE,TRUE NEGATIVE,TRUE NEGATIVE
8,resty-gwt,org.fusesource.restygwt.rebind.DirectRestServiceInterfaceClassCreator,getMethodCallback(JMethod),867b917c43c32acbdcac55767e7f04334006c866,FALSE,FALSE,FALSE,FALSE,FALSE,TRUE,Guilherme,x,,,Yes,"The changes are individually supposed to satisfy are not satisfied: left changes method's expected result by right. Suppose a test that receives an ""Overlay"" method returning a primitive type (int; for instance). The test then checks if result type's is ""OverlayCallback"". The test fails on base; passes on right; and fails on the merged version. A test case can be found here.",[83; 84; 85],[86; 87; 88; 89; 90; 91],changed if statement (condition; and block) on method getMethodCallback(JMethod),extracted variable refactoring and added if statement on method getMethodCallback(JMethod),TRUE,TRUE POSITIVE,FALSE NEGATIVE,FALSE NEGATIVE,FALSE NEGATIVE,TRUE POSITIVE
9,storm,org.apache.storm.kafka.spout.KafkaSpout,open(Map; TopologyContext; SpoutOutputCollector),ad2be678831b3b060229fd936e3908110162b7ac,FALSE,FALSE,FALSE,FALSE,FALSE,FALSE,Mining,,,,No,There is no locally observable interference as the contributions change different and not related fields.,[],[118; 102],Left removes the assignment value to field maxRetries; which was also removed by Left.,Right assigns a value for field refreshSubscriptionTimer; which was also added by Right.,FALSE,TRUE NEGATIVE,TRUE NEGATIVE,TRUE NEGATIVE,TRUE NEGATIVE,TRUE NEGATIVE
10,storm,org.apache.storm.kafka.spout.KafkaSpoutConfig,KafkaSpoutConfig(Builder<K;V>),ad2be678831b3b060229fd936e3908110162b7ac,FALSE,FALSE,FALSE,FALSE,FALSE,FALSE,Mining,,,,No,There is no locally observable interference as the contributions change different and not related fields.,[],[435; 436; 437; 438; 439; 440; 441; 430; 431],Left removes the assignment for field maxRetries; and also its declaration.,Right removes four fields and adds seven fields with their assignment.,FALSE,TRUE NEGATIVE,TRUE NEGATIVE,TRUE NEGATIVE,TRUE NEGATIVE,TRUE NEGATIVE
11,storm,org.apache.storm.kafka.spout.KafkaSpoutConfig,toString(),ad2be678831b3b060229fd936e3908110162b7ac,FALSE,FALSE,FALSE,FALSE,FALSE,FALSE,Leuson,x,,,Yes,Left and Right change the same string that will be returned. This is equivalent to both developers assigning different values to the same variable. A test case should explore the string returned from merge scenario commit. A test case to detect this conflict can be found here.,[],[515; 516; 521; 522],Left removes the field and reference for maxRetries of the returning string from the method toString();,Right performs a refactoring involving the references for key and value variables. It updates how the variable values are accessed (now using get methods instead of directly accessing the values). Right also removes references to the field: kafkaSpoutStreams; tuplesBuilder; topics; and topicWildcardPattern. Finally; it adds reference for subscription and translator.,FALSE,FALSE NEGATIVE,FALSE NEGATIVE,FALSE NEGATIVE,FALSE NEGATIVE,FALSE NEGATIVE
12,storm,org.apache.storm.kafka.spout.KafkaSpout,emitTupleIfNotEmitted(ConsumerRecord<K;V>),bd1f5c54752f67b484a83c26667331234234d3a3,FALSE,FALSE,FALSE,FALSE,TRUE,TRUE,Leuson,x,,,Yes,"report = with isScheduled and isReady =  false;
msgId = new KafkaSpoutMessageId(record);
retryService.isScheduled(msgId) = false
retryService.isReady(msgId) = true
AssertTrue(emiteTupleIfNotEmited(record); true)
when retryService.remove(msg) //launch exception
",[305; 306; 307; 312],[316; 319],Left performs a refactoring extracting a variable of an IF statement; it also changes another IF condition.,Right updates the method signature changing its return type for boolean and adds return statements.,TRUE,TRUE POSITIVE,FALSE NEGATIVE,FALSE NEGATIVE,FALSE NEGATIVE,TRUE POSITIVE
13,swagger-maven-plugin,com.github.kongchen.swagger.docgen.reader.AbstractReader,hasValidAnnotations(List<Annotation>),e825a7fdc6ef688f1253b93d2cb236e710acfc56,FALSE,FALSE,FALSE,FALSE,FALSE,FALSE,Guilherme,x,,,-,Left and Right change the same array (right adds the same elements that left does; and also a new entry). A test case will reveal the interference by calling the method hasValidations twice. Each call with a parameter with only the contributions of one parent. One assertion should expect true based on the entry did by Left; and another expecting False based on the addition by Right. A test case to detect this conflict can be found here.,[342; 343],[342],Left adds items to the returned list used to define the return of method  hasValidAnnotations,Right also adds items to the returned list used to define the return of method  hasValidAnnotations,FALSE,TRUE NEGATIVE,,,,
14,jsoup,org.jsoup.helper.HttpConnection,execute(Connection.Request; Response),a8b6982de98ff76ef254031d7152fff57f6bf941,FALSE,FALSE,FALSE,FALSE,FALSE,FALSE,Roberto,x,x,,Yes,"The parent changes are related; while Right changes a parameter; Left changes a local variable. In the Base commit; the parameter req is changed (req.method(Method.GET); req.data().clear()); the method execute will be called again; but with parameters that makes the first if FALSE (res.hasHeader(LOCATION) && req.followRedirects()). In the Right commit; the if statement status != HTTP_TEMP_REDIR will be FALSE; and no change will be done in req; the method execute will be called again; but with parameters that makes the first if FALSE (res.hasHeader(LOCATION) && req.followRedirects()). In the Merge commit; the if statement status != HTTP_TEMP_REDIR will be FALSE; and no change will be done in req; (res.hasHeader(LOCATION) && req.followRedirects()); the method execute will be called again; but with parameters that makes the first if FALSE (res.hasHeader(LOCATION) && req.followRedirects()). The if statement res.hasHeaderWithValue(CONTENT_ENCODING; ""gzip"") would be FALSE; and then the bodyStream used in res will not be GZIPInputStream. Not possible to set specific values for responses; used to generate the headers.
",[584; 585; 586],[544; 547],Left changes the value assigned to the local variable bodyStream; and also removes the local variable dataStream. The object bodyStream uses the object conn; that is created based on req (changed by Right).,Right adds a new verification before calling some methods of the parameter req.,FALSE,FALSE NEGATIVE,FALSE NEGATIVE,FALSE NEGATIVE,FALSE NEGATIVE,FALSE NEGATIVE
15,jsoup,org.jsoup.helper.HttpConnection,createConnection(Connection.Request),fee4762322f85a1109edd75ccb67f38cf5008c80,FALSE,FALSE,FALSE,FALSE,FALSE,FALSE,Guilherme,x,,,No,There is no locally observable interference as contributions different fields of the same object; with no dependency between the fields in the analyzed method,[609; 610; 611; 612; 613; 614],[617],Left adds a IF statement; allowing extra set fields of the object returned by the method,Rights changes a IF condition; setting more fields of the object returned by the method and accepting more values than before,FALSE,TRUE NEGATIVE,TRUE NEGATIVE,TRUE NEGATIVE,TRUE NEGATIVE,TRUE NEGATIVE
16,jsoup,org.jsoup.helper.HttpConnection,execute(Connection.Request; Response),3f7d2c71dbbbb289c684f339874eed8ac2747fa0,FALSE,FALSE,FALSE,FALSE,FALSE,TRUE,Roberto,x,x,,Yes,"The semantic conflict is caused by the control flow; so based on the changes; different excpetions ca be thrown during the execution. A test case to reveal this problem would be motivated by the next example. Assertion () Entry: 1. status == HttpURLConnection.HTTP_SEE_OTHER. 2. !contentType.startsWith(""application/xml"") == FALSE; !xmlContentTypeRxp.matcher(contentType).matches() == FALSE. In this way; in the base commit; the Exception HttpStatusException would be thrown; and the test would fail. In the left commit; the exception UnsupportedMimeTypeException would be thrown; and the test would pass. Finally; in the merge commit; the no exception would be thrown; and the test would fail.",[456],[483; 484; 485],Left adds a new condition (OR) that is reponsible for changing the value of the local variable needsRedirect.,Right updates another if statement conditions; it changes a set of conditions grouped with AND; to the OR operator. This if is responsible for throw a new exception.,TRUE,TRUE POSITIVE,FALSE NEGATIVE,FALSE NEGATIVE,FALSE NEGATIVE,TRUE POSITIVE
17,jsoup,org.jsoup.nodes.TextNode,outerHtmlHead(StringBuilder; int; Document.OutputSettings),a44e18aa3c1fcd25a68a5965f9490d8f7d026509,FALSE,FALSE,TRUE,TRUE,FALSE,TRUE,Roberto,x,x,,Yes,The changes can be conflicting as the left contributions changes the conditional that updates the value of HTML variable; while right changes the value of accum. In the end; both changes are grouped in the parameter accum. So a test case to detect this conflict should have the following entries and assertions. In the base commit; the first if statement will be FALSE by sending a node that makes the preserveWhiteSpace be FALSE; and no change is performed in the local variable html. The second if will be FALSE as all conditions will be FALSE; so no change is performed in the parameter accum. In the Right commit; the first if statement will be FALSE by sending a node that makes the preserveWhiteSpace be FALSE. So no change is performed in local variable html. In the second if; it will be TRUE as (out.forceAllElementAsBlock() && siblingNodes().size()>0 && !isBlank()) will be TRUE. So the attribute accum will be changed. In the Merge commit; the first if statement will be TRUE by sending a node that makes the preserveWhiteSpace be TRUE. So the changes are performed in the local variable html. In the second if; it will be TRUE as (out.forceAllElementAsBlock() && siblingNodes().size()>0 && !isBlank()) will be TRUE. So the attribute accum will be changed. A test case to detect this conflict can be found here.,[94],[98],Left changes the condition of an if statement; which calls the method preserveWhitespace. Now the method only performs its verifications if the node is not null and is an instance of Element type; otherwise; no action is performed and the value of local variable html is not updated.,Right adds a new condition (OR) in an if statement; which may change the value of the parameter accum.,TRUE,TRUE POSITIVE,FALSE NEGATIVE,FALSE NEGATIVE,TRUE POSITIVE,TRUE POSITIVE
18,retrofit,retrofit.RestAdapter,logAndReplaceResponse(String; Response; long),2b6c719c6645f8e48dca6d0047c752069d321bc4,FALSE,FALSE,FALSE,FALSE,FALSE,FALSE,DeSouza,x,,x,No,Although Left has made a significant change; it is still a refactoring; as the same string is passed as a parameter in the log.log() method call.,[438],[415],Deleted a loop with many calls to log and changed to one with arguments different from the previous call; which simply writes to the log output.,Change the log parameter; adding a toString() on header attribute (header.toString()).,FALSE,TRUE NEGATIVE,TRUE NEGATIVE,TRUE NEGATIVE,TRUE NEGATIVE,TRUE NEGATIVE
19,retrofit,retrofit.RestAdapter,logAndReplaceRequest(Request),2b6c719c6645f8e48dca6d0047c752069d321bc4,FALSE,FALSE,FALSE,FALSE,FALSE,FALSE,DeSouza,x,,x,Yes,The changes are in methods that determine the logs; both interfere in the output. A test case can be made by creating an assert to check the output produced by comparing the string produced by the left and right log; will be different.,[398],[369],Deleted a loop with many calls to log and changed to one with arguments different from the previous call; which simply writes to the log output.,Change the log parameter; adding a toString() on header attribute (header.toString()).,FALSE,FALSE NEGATIVE,FALSE NEGATIVE,FALSE NEGATIVE,FALSE NEGATIVE,FALSE NEGATIVE
20,retrofit,retrofit.RequestBuilder,build(),71f622ce51031b152a0be6ad5facfb27a654bf5a,FALSE,FALSE,FALSE,FALSE,TRUE,FALSE,Roberto,x,x,,Yes,The changes are conflicting as they change the same local variable used to create the returned object. A test case to detect this conflict can be found here.,[88],[96; 97; 100; 95],"Left changed the argument of a method call and chained it with another call. Semantically; it inserts ""?"" in the middle of a string stored in the url variable.",Right adds an if statement that surrounds an assignment (which comes from base) to the url variable.,TRUE,TRUE POSITIVE,FALSE NEGATIVE,FALSE NEGATIVE,FALSE NEGATIVE,TRUE POSITIVE
21,activiti,org.activiti.engine.impl.persistence.entity.DeploymentEntityManager,deleteDeployment(String; boolean),50d8e43eb5917c63abfbcdec1e68e510943f325a,FALSE,FALSE,FALSE,FALSE,FALSE,TRUE,Roberto,x,x,,Yes,The new routine will be only executed in case an if condition is satisfied; this condition requires the use of nrOfProcessDefinitionsWithSameKey; that was changed by Left. In the Base commit; the if statement !p.getId().equals(processDefinition) would be FALSE; so the variable nrOfProcessDefinitionsWithSameKey would not be incremented; and the if (nrOfVersions - nrOfProcessDefinitionsWithSameKey <= 1) would be also FALSE. In the Left commit; the if !p.getId().equals(processDefinition.getId()) would be TRUE; and the variable nrOfProcessDefinitionsWithSameKey would be incremented; and the if if (nrOfVersions - nrOfProcessDefinitionsWithSameKey <= 1) would be TRUE. In the Merge commit; the if !p.getId().equals(processDefinition.getId()) would be TRUE; and the variable nrOfProcessDefinitionsWithSameKey would be incremented; and the if if (nrOfVersions - nrOfProcessDefinitionsWithSameKey <= 1) would be TRUE; and the new routine would be executed (lines 114-117). The problem here is to detect this behavior change as the changed variable are local (neither parameters nor class attributes).,[107],[114; 115; 116; 117],Left changes a if condition; that is reponsible for changing the value of the local variable nrOfProcessDefinitionsWithSameKey (incrementation),Right adds a new IF statement; in case the condition is TRUE; it calls new mtethod using the objects of the local list timerStartJobs.,TRUE,TRUE POSITIVE,FALSE NEGATIVE,FALSE NEGATIVE,FALSE NEGATIVE,TRUE POSITIVE
22,activiti,org.activiti.engine.impl.bpmn.behavior.UserTaskActivityBehavior,execute(ActivityExecution),bf46684ba62f5883673ea8fb0a14aecfe0aedea2,TRUE,TRUE,TRUE,TRUE,FALSE,TRUE,Roberto,x,x,,Yes,By following the changes made by the two developers by getStack > threadLocal.set > this.createMap; we have that the two developers interfere by changing the threadLocals attribute of the Thread class,[112; 113; 114; 115; 116; 117; 110; 111],[118; 125; 126; 127],Left adds a new IF statement; which may set the field formKey of the local variable formKey; or throws an exception.,Right adds a new IF statement; which may call static external methods without using their returns.,TRUE,TRUE POSITIVE,TRUE POSITIVE,TRUE POSITIVE,TRUE POSITIVE,TRUE POSITIVE
23,okhttp,com.squareup.okhttp.internal.bytes.GzipSource,consumeHeader(Deadline),1151c9853ccc3c9c3211c613b9b845b925f8c6a6,FALSE,FALSE,FALSE,FALSE,FALSE,TRUE,Roberto,x,x,,No,There is no locally observable interference as both contributions are refactorings.,[112],[138],Left does a refactoring by renaming the method getByte on OkBuffer class.,Right does a refactoring by extracting the local method seek to OkBuffers class.,TRUE,FALSE POSITIVE,TRUE NEGATIVE,TRUE NEGATIVE,TRUE NEGATIVE,FALSE POSITIVE
24,okhttp,com.squareup.okhttp.OkHttpClient,copyWithDefaults(),35166168529bd27281685e56a0a122eff44460e9,FALSE,FALSE,FALSE,FALSE,FALSE,FALSE,DeSouza,x,,x,No,There is no locally observable interference as Left and right change the object that will be returned by the method; but different attributes.,[277; 293],[287],Left changed the object returned by the method using the current object of the class and ass a new value to the field transports.,Right changes the value assigned to result.hostnameverifier adding now an object OkHostnameVerifier.,FALSE,TRUE NEGATIVE,TRUE NEGATIVE,TRUE NEGATIVE,TRUE NEGATIVE,TRUE NEGATIVE
25,HikariCP,com.zaxxer.hikari.HikariConfig,validate(),1bca94af9ec625f21d1b58ff10efb5be71ab87a6,FALSE,FALSE,FALSE,FALSE,FALSE,FALSE,Roberto,x,x,,Yes,There is a locally observable interference as both contributions write on local variable logger.,[577; 578; 579; 580; 581; 582],[],Left adds a new IF statement; which may write in logger calling method info,Right removes source code; which would write in logger calling method error or wanr; or even trhows an exception. Changes on formating,FALSE,FALSE NEGATIVE,FALSE NEGATIVE,FALSE NEGATIVE,FALSE NEGATIVE,FALSE NEGATIVE
26,HikariCP,com.zaxxer.hikari.HikariPool,addConnection(),1bca94af9ec625f21d1b58ff10efb5be71ab87a6,FALSE,FALSE,TRUE,FALSE,TRUE,TRUE,Mining,x,,,Yes,There is a locally observable interference as the first IF of the WHILE could break its loop. On Base commit; no break would occur; on Left commit; it could break considering the addition of a new verification on the IF; and on Merge commit; no break considering Right changes the value assigned to retries. The assertion should explore the number of elements added on the field idleConnectionBag.,[356; 372; 374; 365],[339; 340; 341; 342; 343; 344; 345; 362; 346; 348],Left adds a new verification an an IF condition; does a refactoring for an old IF; and also adds a call for a local method.,Rights changes the assigment to local variable retries; adds some new IF statements; and sets the field loginTimeout on datasource.,TRUE,TRUE POSITIVE,FALSE NEGATIVE,FALSE NEGATIVE,TRUE POSITIVE,TRUE POSITIVE
27,pushy,com.relayrides.pushy.apns.PushManager,handleConnectionFailure(ApnsConnection<T>; Throwable),58901c846e4f0874977c5aabbc34bcb4de3670e0,FALSE,FALSE,FALSE,FALSE,FALSE,FALSE,Mining,x,,,No,There is no locally observable interference because the right developer performed an refactoring. .,[481; 482; 483; 484; 485; 476; 478],[490],Left added a local variable called pushManager and created a for loop to iterate over a list of FailedConnectionListener.,"The right developer performed an ""extract method;"" which is a structural refactoring for the method startNewConnection(). ",FALSE,TRUE NEGATIVE,TRUE NEGATIVE,TRUE NEGATIVE,TRUE NEGATIVE,TRUE NEGATIVE
28,pushy,com.relayrides.pushy.apns.PushManager,handleConnectionClosure(ApnsConnection<T>),58901c846e4f0874977c5aabbc34bcb4de3670e0,FALSE,FALSE,FALSE,FALSE,FALSE,FALSE,Guilherme,x,,,No,There is no locally observable interference as Right changes are only refactorings; and only Left changes might impact behavior,[520; 510],[515; 500; 502; 503],Left replaces “new Thread” with “listenerExecutor”,"Right does a refactoring by “extracting"" two local methods.",FALSE,TRUE NEGATIVE,TRUE NEGATIVE,TRUE NEGATIVE,TRUE NEGATIVE,TRUE NEGATIVE
29,java-faker,com.github.javafaker.Faker,Faker(Locale; Random),ca42fcfaf45cae1754c58e02e1d5d2a58ec03561,FALSE,FALSE,FALSE,FALSE,FALSE,FALSE,Guilherme,x,,,No,There is no locally observable interference as the contributions change different fields.,[69; 59],[70],Left adds an initialization of two fields on constructor.,Right changes the initialization of a different field.,FALSE,TRUE NEGATIVE,TRUE NEGATIVE,TRUE NEGATIVE,TRUE NEGATIVE,TRUE NEGATIVE
30,swagger-core,io.swagger.jaxrs2.OperationParser,getSchemaFromAnnotation(io.swagger.oas.annotations.media.Schema),e7fea7c4889dbdd6a4e0b2d059c8aa0f126ab1c2,FALSE,FALSE,FALSE,FALSE,FALSE,FALSE,Guilherme,x,,,No,There is no locally observable interference as Right changes are refactorings; and only Left changes modify the program behavior.,[240; 241; 234; 235; 236; 237; 238; 239],[244; 187; 188],Left adds two IF statements; which may set some fields on object schemaObject.,Right renames three methods _enum() to allowableValues(); and _default() to defaultValue,FALSE,TRUE NEGATIVE,TRUE NEGATIVE,TRUE NEGATIVE,TRUE NEGATIVE,TRUE NEGATIVE
